Day,Mission Title,Instruction,English Example,Today's Reflection,Score,Reward
1,Press Restart Button!,Say I am restarting my English journey,I am restarting my English journey today.,,3,Coffee Reward
2,3-Sentence Story Master,Tell morning events in 3 sentences,I overslept missed the bus but smiled anyway.,,4,5 minutes early finish
3,No Translation Challenge,Speak using images not Japanese,My brain is still sleeping.,,3,Chocolate treat
4,Recording Survivor,Listen to your voice and praise yourself,(Free topic),,4,10 min favorite video
5,Failure Hero,Tell failure stories in English,I said I am exciting to my boss 😅,,4,Evening yoga
6,Boss Report Mission,Speak as if reporting to boss,I checked the report. It is ready.,,3,Bath salts
7,Final Quest,Speak I am deserved to do it,I feel ready to speak English anytime.,,5,Give yourself applause

